{
  "version": "2.0.0-alpha.1",
  "createdAt": "2026-03-21T06:30:23.860Z",
  "scenePlanRunId": "zeromemory-2026-03-21T06-27-17-clear_weekend_bookstore",
  "platform": "instagram",
  "dryRun": true,
  "status": "dry_run_ready",
  "imageSource": "v2_generated_image",
  "imageUrl": "https://dashscope-result-bj.oss-cn-beijing.aliyuncs.com/7d/ba/20260321/448165f2/383afefd-7c6b-4723-bf6d-7b8a80de74292040388983.png?Expires=1774680387&OSSAccessKeyId=LTAI5tPxpiCM2hjmWrFXrym1&Signature=tBKrBQLRtnXMQ8BnUJ0Q%2FSyzbzM%3D",
  "altText": "翻找充电线时，在抽屉角落摸到一枚很久没用的发夹，金属部分有点凉。",
  "releaseStage": "image_ready",
  "captionChars": 30,
  "publishTarget": {
    "graphApiBase": "https://graph.facebook.com/v19.0",
    "mode": "dry_run",
    "provider": "aliyun-z-image",
    "providerEndpoint": "https://dashscope.aliyuncs.com/api/v1/services/aigc/multimodal-generation/generation"
  },
  "result": null,
  "notes": [
    "Dry run only: the package is structurally ready for a real publish attempt."
  ]
}